{
  "campaign_id": "campaign-local-001",
  "capital_bucket": "1000",
  "status": "armed",
  "active_strategy_contract_id": "SQ02_DOWNSIDE_CONT_V0",
  "active_session_id": "session-sq02-local-001",
  "realized_pnl": "90",
  "unrealized_pnl": "0",
  "loss_lock": false,
  "profit_protect_active": true,
  "hard_lock_reason": null,
  "rule_version": "personal_campaign_local_v0",
  "invariant_checks": [
    "allow:human_arm:docs_schema_example",
    "profit-protect:threshold_reached"
  ]
}
